{
  "schemaVersion": "effectproof.dev/authorization/v0.1",
  "decisionId": "decision-7f3a9c",
  "agentId": "agent:soc-remediator",
  "principal": "user:security-lead@example.com",
  "workloadId": "k8s:security/soc-remediator-0",
  "toolCallId": "call-remediate-1042",
  "operation": "file.open",
  "target": "/evidence/case-1042.json",
  "effect": "read",
  "argumentsDigest": "sha256:c97812e4d275135bfad98e0720d2310c85c0aa7f02ef8b933893d699c0cffe1f",
  "policyId": "soc-remediation",
  "policyGeneration": "42",
  "policyDigest": "sha256:4e50567e237e7af91ad2cc147858f1cc97e4f8864c8ade7d0fd10fd595bf2078",
  "policyComplete": true,
  "issuedAt": "2026-08-22T12:00:00.000Z",
  "expiresAt": "2026-08-22T12:01:00.000Z",
  "nonce": "nonce-01K36R6AWT"
}
